{
  "$schema": "https://json-schema.org/draft/2020-12/schema",
  "type": "object",
  "additionalProperties": false,
  "required": [
    "task_id",
    "conclusion",
    "result",
    "claimed_assurance",
    "scope",
    "completeness",
    "evidence",
    "limitations"
  ],
  "properties": {
    "task_id": {
      "const": "jacobian/gaussian-two-sum-fourth-moment"
    },
    "conclusion": {
      "const": "TRUE"
    },
    "result": {
      "type": "object",
      "additionalProperties": false,
      "required": [
        "moment"
      ],
      "properties": {
        "moment": {
          "type": "object",
          "additionalProperties": false,
          "required": [
            "real",
            "imaginary"
          ],
          "properties": {
            "real": {
              "type": "object",
              "additionalProperties": false,
              "required": [
                "num",
                "den"
              ],
              "properties": {
                "num": {
                  "type": "string"
                },
                "den": {
                  "type": "string"
                }
              }
            },
            "imaginary": {
              "type": "object",
              "additionalProperties": false,
              "required": [
                "num",
                "den"
              ],
              "properties": {
                "num": {
                  "type": "string"
                },
                "den": {
                  "type": "string"
                }
              }
            }
          }
        }
      }
    },
    "claimed_assurance": {
      "enum": [
        "UNVERIFIED",
        "COMPUTED",
        "CHECKED"
      ]
    },
    "scope": {
      "const": "jacobian/gaussian-two-sum-fourth-moment complete finite input"
    },
    "completeness": {
      "const": "COMPLETE"
    },
    "evidence": {
      "type": "array",
      "minItems": 1,
      "items": {
        "type": "object",
        "additionalProperties": false,
        "required": [
          "path",
          "sha256"
        ],
        "properties": {
          "path": {
            "const": "evidence/answer.txt"
          },
          "sha256": {
            "type": "string",
            "pattern": "^sha256:[0-9a-f]{64}$"
          }
        }
      }
    },
    "limitations": {
      "type": "array",
      "items": {
        "type": "string"
      }
    }
  }
}
